{
  "$schema": "http://json-schema.org/draft-07/schema#",
  "title": "NetNetWorkOrder",
  "type": "object",
  "required": [
    "id",
    "objective",
    "constraints",
    "deliverables",
    "acceptance_tests"
  ],
  "additionalProperties": false,
  "properties": {
    "id": {
      "type": "string",
      "minLength": 3
    },
    "objective": {
      "type": "string",
      "minLength": 8
    },
    "constraints": {
      "type": "array",
      "items": {
        "type": "string",
        "minLength": 2
      },
      "minItems": 1
    },
    "deliverables": {
      "type": "array",
      "items": {
        "type": "string",
        "minLength": 2
      },
      "minItems": 1
    },
    "acceptance_tests": {
      "type": "array",
      "items": {
        "type": "string",
        "minLength": 2
      },
      "minItems": 1
    },
    "context_paths": {
      "type": "array",
      "items": {
        "type": "string"
      }
    },
    "assumptions": {
      "type": "array",
      "items": {
        "type": "string"
      }
    },
    "generated_at": {
      "type": "string"
    }
  }
}
